{
  "$schema": "http://json-schema.org/draft-06/schema",
  "type": "object",
  "properties": {
    "version": {
      "type": "number"
    },
    "success": {
      "type": "boolean"
    },
    "reason": {},
    "content": {
      "type": "object",
      "properties": {
        "incident_artifact_deletion": {
          "type": "object",
          "properties": {
            "success": {
              "type": "boolean"
            },
            "title": {},
            "message": {},
            "hints": {
              "type": "array"
            }
          }
        },
        "global_artifact_deletion": {
          "type": "object",
          "properties": {
            "success": {
              "type": "boolean"
            },
            "title": {},
            "message": {},
            "hints": {
              "type": "array"
            }
          }
        }
      }
    },
    "raw": {},
    "inputs": {
      "type": "object",
      "properties": {
        "incident_id": {
          "type": "integer"
        },
        "artifact_id_list": {
          "type": "string"
        },
        "artifact_remove_globally": {
          "type": "boolean"
        }
      }
    },
    "metrics": {
      "type": "object",
      "properties": {
        "version": {
          "type": "string"
        },
        "package": {
          "type": "string"
        },
        "package_version": {
          "type": "string"
        },
        "host": {
          "type": "string"
        },
        "execution_time_ms": {
          "type": "integer"
        },
        "timestamp": {
          "type": "string"
        }
      }
    }
  }
}